{"schema_version":"1.0.0-fixture","fixture":true,"operational":false,"label":"Current Production Map — V1","preview_mode":"Read-only preview","embed_url":"https://setoxxx.github.io/nycif-field-desk/","full_map_url":"https://setoxxx.github.io/nycif-field-desk/","wordpress_map_url":"https://nycinfocus.com/map/","feed_branch":"main","qa_status":"PASS","map_replacement_authorized":false}